O20191106000532,IA,00-17,PART A PROVIDER - RURAL HEALTH CLINIC,1447802400,N,168628,8224931548,UNITY HEALTHCARE,UNITYPOINT CLINIC - MULBERRY,CH,CHANGE OF OWNERSHIP,12/08/2019,O20180726001535,IA,00-17,PART A PROVIDER - RURAL HEALTH CLINIC,1306335740,N,168972,8729992318,IOWA PHYSICIANS CLINIC MEDICAL FOUNDATION,UNITYPOINT CLINIC FAMILY MEDICINE MULBERRY
O20191112000089,IN,00-17,PART A PROVIDER - RURAL HEALTH CLINIC,1023009339,N,158516,6901871276,PERRY COUNTY MEMORIAL HOSPITAL,TELL CITY CLINIC,CH,CHANGE OF OWNERSHIP,10/01/2019,O20141021000209,IN,00-17,PART A PROVIDER - RURAL HEALTH CLINIC,1023009339,N,158516,0648275255,TELL CITY CLINIC,TELL CITY CLINIC
O20191112000884,TX,00-17,PART A PROVIDER - RURAL HEALTH CLINIC,1861958274,N,453918,7517137748,HUNT REGIONAL MEDICAL PARTNERS,,CH,CHANGE OF OWNERSHIP,08/01/2019,O20091105000677,TX,00-17,PART A PROVIDER - RURAL HEALTH CLINIC,1508848029,N,453918,0042279846,SELVAGGI INVESTMENTS,LIVE OAK PROFESSIONAL CENTER
O20191112001070,MT,00-17,PART A PROVIDER - RURAL HEALTH CLINIC,1003466822,N,273824,6406288547,BATES FAMILY DIVERSIFIED LLC,THREE RIVERS CLINIC,CH,CHANGE OF OWNERSHIP,10/01/2019,O20080721000788,MT,00-17,PART A PROVIDER - RURAL HEALTH CLINIC,1851425789,N,273824,5698848869,"THREE RIVERS CLINIC, LLC",
O20191119003103,MA,00-17,PART A PROVIDER - RURAL HEALTH CLINIC,1639737042,N,223977,1254240773,FAIRVIEW HOSPITAL,WILLIAMSTOWN MEDICAL AT NORTH ADAMS,CH,CHANGE OF OWNERSHIP,09/30/2019,O20190708001033,MA,00-17,PART A PROVIDER - RURAL HEALTH CLINIC,1639737042,N,223804,8224068424,BERKSHIRE FACULTY SERVICES INC,WILLIAMSTOWN MEDICAL AT NORTH ADAMS
O20191120001514,TN,00-17,PART A PROVIDER - RURAL HEALTH CLINIC,1578125647,N,883800,7012246069,FAMILY CLINIC AT THE LAKE PLLC,,CH,CHANGE OF OWNERSHIP,11/01/2019,O20171020001919,TN,00-17,PART A PROVIDER - RURAL HEALTH CLINIC,1851593594,N,883800,8426148206,MELANIE A REAVES PLLC,FAMILY CLINIC AT THE LAKE
O20191125001301,AL,00-17,PART A PROVIDER - RURAL HEALTH CLINIC,1477979672,N,013457,4082047477,RMCCA CLINIC A LLC,REGIONAL MEDICAL CENTER CLINICS,CH,CHANGE OF OWNERSHIP,09/01/2019,O20190711000392,AL,00-17,PART A PROVIDER - RURAL HEALTH CLINIC,1477979672,N,013457,9436418209,THE HEALTH CARE AUTHORITY OF THE CITY OF GREENVILLE - LV STABLER HOSPI,REGIONAL MEDICAL CENTER CLINICS
O20200110001501,CA,00-17,PART A PROVIDER - RURAL HEALTH CLINIC,1417027095,N,058625,3072421197,ADVENTIST HEALTH CLEARLAKE HOSPITAL INC.,ADVENTIST HEALTH CLEARLAKE,CH,CHANGE OF OWNERSHIP,12/30/2019,O20060915000590,CA,00-17,PART A PROVIDER - RURAL HEALTH CLINIC,1417027095,N,058625,6406816123,UKIAH ADVENTIST HOSPITAL,ADVENTIST HEALTH UKIAH VALLEY
O20200121000684,IA,00-17,PART A PROVIDER - RURAL HEALTH CLINIC,1164068656,N,168635,0941587307,UNITYPOINT HEALTH - MARSHALLTOWN,UNITYPOINT CLINIC - FAMILY MEDICINE - PARKERSBURG,CH,CHANGE OF OWNERSHIP,12/22/2019,O20081203000311,IA,00-17,PART A PROVIDER - RURAL HEALTH CLINIC,1811945587,N,168903,8729992318,IOWA PHYSICIANS CLINIC MEDICAL FOUNDATION,UNITYPOINT CLINIC FAMILY MEDICINE PARKERSBURG
O20200123000747,NY,00-17,PART A PROVIDER - RURAL HEALTH CLINIC,1093362931,N,333992,3678550837,LITTLE FALLS HOSPITAL,,CH,CHANGE OF OWNERSHIP,12/19/2019,O20190826001743,NY,00-17,PART A PROVIDER - RURAL HEALTH CLINIC,1780600577,Y,333992,3779488325,MARY IMOGENE BASSETT HOSPITAL,
O20200123001265,NY,00-17,PART A PROVIDER - RURAL HEALTH CLINIC,1912554791,N,333995,3678550837,LITTLE FALLS HOSPITAL,LITTLE FALLS HOSPITAL RICHFIELD SPRINGS HEALTH CENTER,CH,CHANGE OF OWNERSHIP,12/19/2019,O20190827001123,NY,00-17,PART A PROVIDER - RURAL HEALTH CLINIC,1780600577,Y,333995,3779488325,MARY IMOGENE BASSETT HOSPITAL,
O20200123001640,NY,00-17,PART A PROVIDER - RURAL HEALTH CLINIC,1205483005,N,333996,3678550837,LITTLE FALLS HOSPITAL,LITTLE FALLS HOSPITAL WEST WINFIELD HEALTH CENTER,CH,CHANGE OF OWNERSHIP,12/19/2019,O20190822001063,NY,00-17,PART A PROVIDER - RURAL HEALTH CLINIC,1780600577,Y,333996,3779488325,MARY IMOGENE BASSETT HOSPITAL,
O20200123001640,NY,00-17,PART A PROVIDER - RURAL HEALTH CLINIC,1205483005,N,333996,3678550837,LITTLE FALLS HOSPITAL,LITTLE FALLS HOSPITAL WEST WINFIELD HEALTH CENTER,CH,CHANGE OF OWNERSHIP,12/19/2019,O20190827000053,NY,00-17,PART A PROVIDER - RURAL HEALTH CLINIC,1780600577,N,333996,3779488325,MARY IMOGENE BASSETT HOSPITAL,
O20200124000946,NY,00-17,PART A PROVIDER - RURAL HEALTH CLINIC,1104473990,N,333993,3678550837,LITTLE FALLS HOSPITAL,,CH,CHANGE OF OWNERSHIP,12/19/2019,O20190821002520,NY,00-17,PART A PROVIDER - RURAL HEALTH CLINIC,1780600577,Y,333993,3779488325,MARY IMOGENE BASSETT HOSPITAL,
O20200128000331,OH,00-17,PART A PROVIDER - RURAL HEALTH CLINIC,1629628920,N,363418,8921431131,ADAMS COUNTY REGIONAL MEDICAL CENTER,ADAMS COUNTY REGIONAL MEDICAL CENTER FAMILY MEDICINE (ACRMC),CH,CHANGE OF OWNERSHIP,10/01/2019,O20181018002006,OH,00-17,PART A PROVIDER - RURAL HEALTH CLINIC,1821578246,N,363418,5799730354,ADAMS COUNTY HOSPITAL,
O20200205000285,IA,00-17,PART A PROVIDER - RURAL HEALTH CLINIC,1255977740,N,168634,0941587307,UNITYPOINT HEALTH - MARSHALLTOWN,UNITYPOINT CLINIC - FAMILY MEDICINE - GRUNDY CENTER,CH,CHANGE OF OWNERSHIP,12/22/2019,O20050308000535,IA,00-17,PART A PROVIDER - RURAL HEALTH CLINIC,1013952183,N,168953,8729992318,IOWA PHYSICIANS CLINIC MEDICAL FOUNDATION,UNITYPOINT CLINIC FAMILY MEDICINE GRUNDY  CENTER
O20200219000430,KS,00-17,PART A PROVIDER - RURAL HEALTH CLINIC,1982242152,N,178567,4587090121,HILLSBORO HOSPITAL LLC,HILLSBORO CLINIC,CH,CHANGE OF OWNERSHIP,12/09/2019,O20111103000922,KS,00-17,PART A PROVIDER - RURAL HEALTH CLINIC,1063792919,N,178567,0345300323,CAH ACQUISITION COMPANY 5 LLC,HILLSBORO CLINIC
O20200224000801,AL,00-17,PART A PROVIDER - RURAL HEALTH CLINIC,1508491093,N,013486,3476878489,RUSSELLVILLE HOSPITAL INC.,RUSSELLVILLE HOSPITAL FAMILY CARE FIRST CLINIC,CH,CHANGE OF OWNERSHIP,12/13/2019,O20131111001637,AL,00-17,PART A PROVIDER - RURAL HEALTH CLINIC,1568758274,N,018913,6901086131,FAMILY CARE FIRST INC,
O20200228000357,OR,00-17,PART A PROVIDER - RURAL HEALTH CLINIC,1417098773,N,383802,3476786609,ORCHID OAKRIDGE CLINIC PC,ORCHID HEALTH- MCKENZIE RIVER CLINIC,CH,CHANGE OF OWNERSHIP,01/01/2020,O20101108000756,OR,00-17,PART A PROVIDER - RURAL HEALTH CLINIC,1417098773,N,383802,4587650361,MCKENZIE RIVER CLINIC,
O20200306000220,MO,00-17,PART A PROVIDER - RURAL HEALTH CLINIC,1255847745,N,268648,8820329782,COX BARTON COUNTY HOSPITAL,MEDICAL ONE CLINIC,CH,CHANGE OF OWNERSHIP,01/01/2018,O20180518000109,MO,00-17,PART A PROVIDER - RURAL HEALTH CLINIC,1295241784,N,268762,6406116797,CBCH LLC,
O20200310001975,ME,00-17,PART A PROVIDER - RURAL HEALTH CLINIC,1295367803,N,208528,3476462797,SEBASTICOOK VALLEY HEALTH,NORTHERN LIGHT SEBASTICOOK VALLEY HOSPITAL,CH,CHANGE OF OWNERSHIP,01/13/2020,O20040719000123,ME,00-17,PART A PROVIDER - RURAL HEALTH CLINIC,1760450910,N,203857,8325027824,NEWPORT FAMILY PRACTICE PA,NEWPORT FAMILY PRACTICE
O20200320000349,MS,00-17,PART A PROVIDER - RURAL HEALTH CLINIC,1770715450,N,258556,1052397767,FORREST COUNTY GENERAL HOSPITAL,,CH,CHANGE OF OWNERSHIP,02/01/2020,O20091027000524,MS,00-17,PART A PROVIDER - RURAL HEALTH CLINIC,1770715450,N,258556,5496704363,PEARL RIVER COUNTY HOSPITAL & NURSING HOME,
O20200401003164,CA,00-17,PART A PROVIDER - RURAL HEALTH CLINIC,1285054106,N,058676,3072421197,ADVENTIST HEALTH CLEARLAKE HOSPITAL INC.,ADVENTIST HEALTH CLEARLAKE,CH,CHANGE OF OWNERSHIP,04/01/2020,O20190514001491,CA,00-17,PART A PROVIDER - RURAL HEALTH CLINIC,1285054106,N,058676,9234036088,RIDEOUT MEMORIAL HOSPITAL,ADVENTIST HEALTH AND RIDEOUT
O20200402000632,CA,00-17,PART A PROVIDER - RURAL HEALTH CLINIC,1912092792,N,058604,3072421197,ADVENTIST HEALTH CLEARLAKE HOSPITAL INC.,ADVENTIST HEALTH CLEARLAKE,CH,CHANGE OF OWNERSHIP,04/01/2020,O20190520001900,CA,00-17,PART A PROVIDER - RURAL HEALTH CLINIC,1912092792,N,058604,9234036088,RIDEOUT MEMORIAL HOSPITAL,ADVENTIST HEALTH AND RIDEOUT
O20200403000182,ME,00-17,PART A PROVIDER - RURAL HEALTH CLINIC,1548382328,N,203993,1355770892,MRH CORP,NORTHERN LIGHT PRIMARY CARE DOVER-FOXCROFT,CH,CHANGE OF OWNERSHIP,03/01/2020,O20070418000369,ME,00-17,PART A PROVIDER - RURAL HEALTH CLINIC,1548382328,N,203993,6305755141,HOSPITAL ADMINISTRATIVE DISTRICT 4,DOVER FOXCROFT FAMILY PRACTICE
O20200406001647,ME,00-17,PART A PROVIDER - RURAL HEALTH CLINIC,1033231154,N,203991,1355770892,MRH CORP,NORTHERN LIGHT PRIMARY CARE MILO,CH,CHANGE OF OWNERSHIP,03/01/2020,O20070418000343,ME,00-17,PART A PROVIDER - RURAL HEALTH CLINIC,1033231154,N,203991,6305755141,HOSPITAL ADMINISTRATIVE DISTRICT 4,MILO FAMILY PRACTICE
O20200408000988,ME,00-17,PART A PROVIDER - RURAL HEALTH CLINIC,1891888657,N,208522,1355770892,MRH CORP,NORTHERN LIGHT PRIMARY CARE CORINTH,CH,CHANGE OF OWNERSHIP,03/01/2020,O20130528000010,ME,00-17,PART A PROVIDER - RURAL HEALTH CLINIC,1891888657,N,208522,6305755141,HOSPITAL ADMINISTRATIVE DISTRICT 4,
O20200413001955,MI,00-17,PART A PROVIDER - RURAL HEALTH CLINIC,1104459627,N,238533,9032008495,BRONSON LAKEVIEW HOSPITAL,BRONSON LAKEVIEW FAMILY CARE - BANGOR,CH,CHANGE OF OWNERSHIP,03/31/2020,O20170505001368,MI,00-17,PART A PROVIDER - RURAL HEALTH CLINIC,1770599052,N,238533,6204724834,BRONSON SOUTH HAVEN HOSPITAL,BRONSON SOUTH HAVEN FAMILY MEDICINE COOPER CLINIC
O20200501000241,IA,00-17,PART A PROVIDER - RURAL HEALTH CLINIC,1487289955,N,168641,0547257990,HAWARDEN REGIONAL HEALTHCARE,AKRON CLINIC,CH,CHANGE OF OWNERSHIP,05/01/2020,O20030310000010,IA,00-17,PART A PROVIDER - RURAL HEALTH CLINIC,1902840671,N,163830,5799694063,MERCY MEDICAL SERVICES,MERCYONE AKRON FAMILY MEDICINE
O20200504001214,TX,00-17,PART A PROVIDER - RURAL HEALTH CLINIC,1306484050,N,673976,6103255732,"HUNTSVILLE COMMUNITY HOSPITAL, INC.",HUNTSVILLE MEMORIAL HOSPITAL,CH,CHANGE OF OWNERSHIP,02/28/2020,O20050908000770,TX,00-17,PART A PROVIDER - RURAL HEALTH CLINIC,1972628816,N,673976,9830121656,WALKER COUNTY HOSPITAL CORPORATION,HUNTSVILLE MEMORIAL HOSPITAL
O20200505000146,KY,00-17,PART A PROVIDER - RURAL HEALTH CLINIC,1568098838,N,183490,0840107835,APPALACHIAN REGIONAL HEALTHCARE INC,ARH MEDICAL AND SPECIALTY ASSOCIATES - SALYERSVILLE,CH,CHANGE OF OWNERSHIP,04/30/2020,O20190917001713,KY,00-17,PART A PROVIDER - RURAL HEALTH CLINIC,1396304044,N,183490,4183953805,"ARH TUG VALLEY HEALTH SERVICES, INC.",ARH MEDICAL AND SPECIALTY ASSOCIATES - SALYERSVILLE
O20200505000268,KY,00-17,PART A PROVIDER - RURAL HEALTH CLINIC,1194351460,N,183477,8123293818,"ARH MARY BRECKINRIDGE HEALTH SERVICES, INC.",ARH MEDICAL AND SPECIALTY ASSOCIATES - HAROLD,CH,CHANGE OF OWNERSHIP,04/30/2020,O20190917001196,KY,00-17,PART A PROVIDER - RURAL HEALTH CLINIC,1033778782,N,183477,4183953805,"ARH TUG VALLEY HEALTH SERVICES, INC.",ARH MEDICAL AND SPECIALTY ASSOCIATES - HAROLD
O20200505002302,OK,00-17,PART A PROVIDER - RURAL HEALTH CLINIC,1982233656,N,373471,3678904752,RURAL WELLNESS FAIRFAX INC,RURAL WELLNESS PAWNEE CLINIC,CH,CHANGE OF OWNERSHIP,03/20/2020,O20130503000323,OK,00-17,PART A PROVIDER - RURAL HEALTH CLINIC,1598039620,N,373471,8820123052,CAH ACQUISITION COMPANY 12 LLC,THE PAWNEE CLINIC
O20200511001103,OK,00-17,PART A PROVIDER - RURAL HEALTH CLINIC,1790314466,N,373468,3678904752,RURAL WELLNESS FAIRFAX INC,RURAL WELLNESS FAIRFAX CLINIC,CH,CHANGE OF OWNERSHIP,03/20/2020,O20110511000360,OK,00-17,PART A PROVIDER - RURAL HEALTH CLINIC,1306145339,Y,373468,8820123052,CAH ACQUISITION COMPANY 12 LLC,FAIRFAX RURAL HEALTH CLINIC
O20200512001840,TN,00-17,PART A PROVIDER - RURAL HEALTH CLINIC,1538703897,N,448992,2860828936,FAMILY MEDICAL CLINIC OF TREZEVANT,,CH,CHANGE OF OWNERSHIP,11/19/2019,O20171128002999,TN,00-17,PART A PROVIDER - RURAL HEALTH CLINIC,1609309855,N,448992,6901173657,PRIMARY CARE CLINIC OF JACKSON,PRIMARY CARE CLINIC OF TREZEVANT
O20200514002436,MN,00-17,PART A PROVIDER - RURAL HEALTH CLINIC,1578736492,N,243443,5890126726,HEALTHPARTNERS RC,HECTOR CLINIC,CH,CHANGE OF OWNERSHIP,05/01/2020,O20071112000654,MN,00-17,PART A PROVIDER - RURAL HEALTH CLINIC,1578736492,Y,243443,6305887092,RENVILLE COUNTY,RENVILLE COUNTY HOSPITAL AND CLINICS
O20200518000608,CA,00-17,PART A PROVIDER - RURAL HEALTH CLINIC,1972072163,N,058722,4183901978,"COLUSA MEDICAL CENTER, LLC",,CH,CHANGE OF OWNERSHIP,01/01/2019,O20060915000562,CA,00-17,PART A PROVIDER - RURAL HEALTH CLINIC,1477667384,N,553909,9638174188,"FRONTIER VILLAGE FAMILY HEALTH CENTER, INC",
O20200518001065,OK,00-17,PART A PROVIDER - RURAL HEALTH CLINIC,1275161457,N,373464,9335570985,DRUMRIGHT COMMUNITY HOSPITAL LLC,DRUMRIGHT RURAL HEALTH CLINIC,CH,CHANGE OF OWNERSHIP,04/13/2020,O20091221000091,OK,00-17,PART A PROVIDER - RURAL HEALTH CLINIC,1659600815,N,373464,9830242031,"CAH ACQUISITION COMPANY 4, INC",DRUMRIGHT RURAL HEALTH CLINIC
O20200518001435,CA,00-17,PART A PROVIDER - RURAL HEALTH CLINIC,1215406400,N,058720,4183901978,"COLUSA MEDICAL CENTER, LLC",,CH,CHANGE OF OWNERSHIP,01/01/2019,O20061027000135,CA,00-17,PART A PROVIDER - RURAL HEALTH CLINIC,1629175856,N,058922,4981601382,"FIRSTCARE MEDICAL ASSOCIATES, INC",
O20200519000108,MN,00-17,PART A PROVIDER - RURAL HEALTH CLINIC,1730352675,N,243444,5890126726,HEALTHPARTNERS RC,RENVILLE CLINIC,CH,CHANGE OF OWNERSHIP,05/01/2020,O20071101000218,MN,00-17,PART A PROVIDER - RURAL HEALTH CLINIC,1730352675,Y,243444,6305887092,RENVILLE COUNTY,RENVILLE COUNTY HOSPITAL AND CLINICS
O20200520002709,MN,00-17,PART A PROVIDER - RURAL HEALTH CLINIC,1932387255,N,243442,5890126726,HEALTHPARTNERS RC,OLIVIA HOSPITAL & CLINIC,CH,CHANGE OF OWNERSHIP,05/01/2020,O20071101000160,MN,00-17,PART A PROVIDER - RURAL HEALTH CLINIC,1932387255,Y,243442,6305887092,RENVILLE COUNTY,RENVILLE COUNTY HOSPITAL & CLINICS
O20200527001437,AL,00-17,PART A PROVIDER - RURAL HEALTH CLINIC,1194811901,N,013482,4385073436,CRENSHAW COUNTY HEALTH CARE AUTHORITY,CRENSHAW FAMILY CARE CENTER,CH,CHANGE OF OWNERSHIP,03/31/2020,O20160609001783,AL,00-17,PART A PROVIDER - RURAL HEALTH CLINIC,1194811901,N,013482,8325006604,PROFESSIONAL RESOURCES MANAGEMENT OF CRENSHAW LLC,
O20200529000498,WV,00-17,PART A PROVIDER - RURAL HEALTH CLINIC,1548893068,N,513987,4284065400,WETZEL COUNTY HOSPITAL INC,WETZEL COUNTY HOSPITAL INC,CH,CHANGE OF OWNERSHIP,07/01/2020,O20040612000660,WV,00-17,PART A PROVIDER - RURAL HEALTH CLINIC,1225176563,N,513987,4688575319,WETZEL COUNTY HOSPITAL ASSOCIATION,WETZEL INTERNAL MEDICINE
O20200530000050,WV,00-17,PART A PROVIDER - RURAL HEALTH CLINIC,1255963120,N,513419,4284065400,WETZEL COUNTY HOSPITAL INC,WETZEL PRIMARY CARE,CH,CHANGE OF OWNERSHIP,07/01/2020,O20151119001067,WV,00-17,PART A PROVIDER - RURAL HEALTH CLINIC,1609272343,N,513419,4688575319,WETZEL COUNTY HOSPITAL ASSOCIATION,WETZEL PRIMARY CARE
O20200611002200,IL,00-17,PART A PROVIDER - RURAL HEALTH CLINIC,1780101204,N,148581,3870914393,CARLE EUREKA HOSPITAL,CARLE EUREKA FAMILY MEDICINE-EUREKA,CH,CHANGE OF OWNERSHIP,07/01/2020,O20171206000019,IL,00-17,PART A PROVIDER - RURAL HEALTH CLINIC,1780101204,N,148581,7810800935,ADVOCATE HEALTH AND HOSPITALS CORPORATION,ADVOCATE EUREKA HOSPITAL
O20200616000202,IL,00-17,PART A PROVIDER - RURAL HEALTH CLINIC,1861919524,N,148582,3870914393,CARLE EUREKA HOSPITAL,CARLE EUREKA FAMILY MEDICINE - EL PASO,CH,CHANGE OF OWNERSHIP,07/01/2020,O20170321000302,IL,00-17,PART A PROVIDER - RURAL HEALTH CLINIC,1861919524,Y,148582,7810800935,ADVOCATE HEALTH AND HOSPITALS CORPORATION,ADVOCATE EUREKA HOSPITAL
O20200619000580,IN,00-17,PART A PROVIDER - RURAL HEALTH CLINIC,1629621396,Y,158517,6901871276,PERRY COUNTY MEMORIAL HOSPITAL,PERRY COUNTY FAMILY PRACTICE,CH,CHANGE OF OWNERSHIP,10/01/2019,O20141202000384,IN,00-17,PART A PROVIDER - RURAL HEALTH CLINIC,1215928536,N,158517,6204867559,PERRY COUNTY FAMILY PRACTICE,
O20200622000712,CA,00-17,PART A PROVIDER - RURAL HEALTH CLINIC,1376164749,N,058714,2466447412,LAST FRONTIER HEALTHCARE DISTRICT,CANBY FAMILY PRACTICE CLINIC,CH,CHANGE OF OWNERSHIP,07/01/2020,O20061204000497,CA,00-17,PART A PROVIDER - RURAL HEALTH CLINIC,1528063153,N,053888,1456395862,I'SOT INC,CANBY FAMILY PRACTICE CLINIC
O20200720003712,TN,00-17,PART A PROVIDER - RURAL HEALTH CLINIC,1770103863,N,443463,6406813781,MAURY REGIONAL HOSPITAL MARSHALL MEDICAL CENTER,MRMG MOB,CH,CHANGE OF OWNERSHIP,06/26/2020,O20200427002636,TN,00-17,PART A PROVIDER - RURAL HEALTH CLINIC,1770103863,N,883823,7911810742,"MAURY REGIONAL MEDICAL GROUP, INC",MRMG MOB
O20200805000448,KS,00-17,PART A PROVIDER - RURAL HEALTH CLINIC,1194732438,N,178578,5496178691,SAINT LUKES HOSPITAL OF ALLEN COUNTY INC,ALLEN COUNTY REGIONAL CLINIC,CH,CHANGE OF OWNERSHIP,07/01/2020,O20130918000576,KS,00-17,PART A PROVIDER - RURAL HEALTH CLINIC,1194732438,N,178578,3173764545,ALLEN COUNTY KANSAS HOSPITAL,ALLEN COUNTY REGIONAL HOSPITAL
O20200810003603,FL,00-17,PART A PROVIDER - RURAL HEALTH CLINIC,1871118604,N,108922,3476978214,HEART 2 HEART FAMILY PRACTICE,,CH,CHANGE OF OWNERSHIP,09/15/2020,O20101130000230,FL,00-17,PART A PROVIDER - RURAL HEALTH CLINIC,1902833668,N,108922,8729274949,BIRTH & BEYOND P.A.,
O20200817000905,TN,00-17,PART A PROVIDER - RURAL HEALTH CLINIC,1881214963,N,443465,6406813781,MAURY REGIONAL HOSPITAL MARSHALL MEDICAL CENTER,MAURY REGIONAL URGENT CARE NORTH,CH,CHANGE OF OWNERSHIP,06/26/2020,O20200501001058,TN,00-17,PART A PROVIDER - RURAL HEALTH CLINIC,1881214963,N,883818,7911810742,"MAURY REGIONAL MEDICAL GROUP, INC",MAURY REGIONAL URGENT CARE NORTH
O20200821000305,TX,00-17,PART A PROVIDER - RURAL HEALTH CLINIC,1568080364,N,453883,7517137748,HUNT REGIONAL MEDICAL PARTNERS,,CH,CHANGE OF OWNERSHIP,07/15/2020,O20161010000934,TX,00-17,PART A PROVIDER - RURAL HEALTH CLINIC,1528283306,N,453883,1355254210,HEALTHTEXAS PROVIDER NETWORK,PCA LEONARD
O20200910000362,KY,00-17,PART A PROVIDER - RURAL HEALTH CLINIC,1558984633,N,B03824,5597867184,BAPTIST HEALTH MEDICAL GROUP INC,BAPTIST HEALTH MEDICAL GROUP FAMILY MEDICINE,CH,CHANGE OF OWNERSHIP,09/01/2020,O20180314000907,KY,00-17,PART A PROVIDER - RURAL HEALTH CLINIC,1558886705,N,188505,4385661628,HARDIN MEMORIAL HOSPITAL,"HMH MEDICAL GROUP, MEADE COUNTY FAMILY MEDICINE"
O20200910002910,LA,00-17,PART A PROVIDER - RURAL HEALTH CLINIC,1639720493,N,198523,4486903309,CLHG-VILLE PLATTE LLC,MERCY RURAL HEALTH CLINIC,CH,CHANGE OF OWNERSHIP,08/01/2020,O20191008002620,LA,00-17,PART A PROVIDER - RURAL HEALTH CLINIC,1639720493,N,198523,1355623943,CLHG-OAKDALE LLC,EVANGELINE PEDIATRICS
O20200916001155,LA,00-17,PART A PROVIDER - RURAL HEALTH CLINIC,1518575380,N,198528,3476458092,ACADIA-ST. LANDRY HOSPITAL SERVICE DISTRICT,FLEUR-DE-LIS RURAL HEALTH CLINIC,CH,CHANGE OF OWNERSHIP,03/18/2020,O20141003000176,LA,00-17,PART A PROVIDER - RURAL HEALTH CLINIC,1598153710,Y,193916,9638104458,"FLEUR-DE-LIS COMMUNITY HEALTH, INC",FLEUR-DE-LIS COMMUNITY HEALTH IN CHURCH POINT
O20200923001775,AR,00-17,PART A PROVIDER - RURAL HEALTH CLINIC,1548881386,N,048519,2668899899,MAGNOLIA REGIONAL HEALTH SYSTEM INC,,CH,CHANGE OF OWNERSHIP,10/01/2020,O20181204003068,AR,00-17,PART A PROVIDER - RURAL HEALTH CLINIC,1093298580,N,048519,8729068630,MAGNOLIA REGIONAL MEDICAL CENTER,
O20200924000857,CA,00-17,PART A PROVIDER - RURAL HEALTH CLINIC,1124220249,N,058629,3678990769,ADVENTIST HEALTH MENDOCINO COAST,,CH,CHANGE OF OWNERSHIP,07/01/2020,O20070509000793,CA,00-17,PART A PROVIDER - RURAL HEALTH CLINIC,1124220249,N,058629,1759364375,MENDOCINO COAST HEALTH CARE DISTRICT,NORTH COAST FAMILY HEALTH CENTER
O20201013002747,WI,00-17,PART A PROVIDER - RURAL HEALTH CLINIC,1063038313,N,528617,2163461781,OCONTO HOSPITAL & MEDICAL CENTER INC,,AM,ACQUISITION/MERGER,10/01/2020,O20050909000172,WI,00-17,PART A PROVIDER - RURAL HEALTH CLINIC,1285696963,N,523866,8820900749,BELLIN MEMORIAL HOSPITAL INC,FMC OCONTO FALLS
O20201021000031,PA,00-17,PART A PROVIDER - RURAL HEALTH CLINIC,1558989970,N,393447,7517870512,ELK REGIONAL HEALTH CENTER,PENN HIGHLANDS ELK,CH,CHANGE OF OWNERSHIP,11/01/2020,O20181128000726,PA,00-17,PART A PROVIDER - RURAL HEALTH CLINIC,1548531213,N,393447,5890689715,DUBOIS REGIONAL MEDICAL CENTER,PENN HIGHLANDS DUBOIS
O20201021000280,PA,00-17,PART A PROVIDER - RURAL HEALTH CLINIC,1245858109,N,393448,7517870512,ELK REGIONAL HEALTH CENTER,PENN HIGHLANDS ELK,CH,CHANGE OF OWNERSHIP,11/01/2020,O20181127001184,PA,00-17,PART A PROVIDER - RURAL HEALTH CLINIC,1649427071,N,393448,5890689715,DUBOIS REGIONAL MEDICAL CENTER,PENN HIGHLANDS DUBOIS
O20201022004027,VA,00-17,PART A PROVIDER - RURAL HEALTH CLINIC,1235756354,N,493440,3678670221,CARILION GILES COMMUNITY HOSPITAL,CARILION CLINIC,CH,CHANGE OF OWNERSHIP,09/08/2020,O20200814001226,VA,00-17,PART A PROVIDER - RURAL HEALTH CLINIC,1477178366,N,498919,5890607253,CARILION HEALTHCARE CORPORATION,
O20201106002390,KS,00-17,PART A PROVIDER - RURAL HEALTH CLINIC,1417901927,N,173494,9638589369,KIOWA COUNTY MEMORIAL HOSPITAL,GREENSBURG FAMILY PRACTICE,CH,CHANGE OF OWNERSHIP,01/01/2021,O20030228000020,KS,00-17,PART A PROVIDER - RURAL HEALTH CLINIC,1417901927,N,173494,8628987096,GREAT PLAINS OF KIOWA CO INC,GREENSBURG FAMILY PRACTICE
O20201110001037,NC,00-17,PART A PROVIDER - RURAL HEALTH CLINIC,1811502818,N,343430,3779993837,CENTENNIAL HOUSING & COMMUNITY SERVICES CORPORATION,PLYMOUTH PRIMARY CARE RURAL HEALTH CLINIC,CH,CHANGE OF OWNERSHIP,10/01/2020,O20080701000261,NC,00-17,PART A PROVIDER - RURAL HEALTH CLINIC,1962650762,N,343430,1759480825,CAH ACQUISITION COMPANY 1 LLC,PLYMOUTH PRIMARY CARE RURAL HEALTH CLINIC
O20201112003283,SC,00-17,PART A PROVIDER - RURAL HEALTH CLINIC,1245837632,N,428943,2567872070,LEXINGTON HEALTH INC,LMC SWANSEA RURAL HEALTH CLINIC,CH,CHANGE OF OWNERSHIP,02/01/2021,O20070108000211,SC,00-17,PART A PROVIDER - RURAL HEALTH CLINIC,1821021254,N,428943,7618871799,LEXINGTON COUNTY HEALTH SERVICES DISTRICT INC,LEXINGTON MEDICAL CENTER SWANSEA
O20201116001823,IN,00-17,PART A PROVIDER - RURAL HEALTH CLINIC,1386269421,N,158559,0941198253,ADAMS COUNTY MEMORIAL HOSPITAL,ADAMS MEDICAL GROUP - BERNE,CH,CHANGE OF OWNERSHIP,07/01/2020,O20080423000485,IN,00-17,PART A PROVIDER - RURAL HEALTH CLINIC,1952405581,N,153829,3375621808,ROBERT EUGENE JUDGE,
O20201123000128,FL,00-17,PART A PROVIDER - RURAL HEALTH CLINIC,1952917015,N,103462,3375557887,HOLMES COUNTY HOSPITAL CORP,BONIFAY RURAL HEALTH CLINIC,CH,CHANGE OF OWNERSHIP,12/31/2020,O20120112000696,FL,00-17,PART A PROVIDER - RURAL HEALTH CLINIC,1962596122,N,683804,9133176431,DR DALE MITCHUM INC,SOUTHERN HEALTH CLINIC
O20201203002156,VA,00-17,PART A PROVIDER - RURAL HEALTH CLINIC,1528685641,N,493442,3678670221,CARILION GILES COMMUNITY HOSPITAL,CARILION CLINIC,CH,CHANGE OF OWNERSHIP,09/08/2020,O20200813003432,VA,00-17,PART A PROVIDER - RURAL HEALTH CLINIC,1972128866,N,498922,5890607253,CARILION HEALTHCARE CORPORATION,
O20201204002543,VA,00-17,PART A PROVIDER - RURAL HEALTH CLINIC,1154948271,N,493443,3678670221,CARILION GILES COMMUNITY HOSPITAL,CARILION CLINIC,CH,CHANGE OF OWNERSHIP,09/08/2020,O20200814001358,VA,00-17,PART A PROVIDER - RURAL HEALTH CLINIC,1760008387,N,498926,5890607253,CARILION HEALTHCARE CORPORATION,
O20201204002571,VA,00-17,PART A PROVIDER - RURAL HEALTH CLINIC,1710504840,N,493441,3678670221,CARILION GILES COMMUNITY HOSPITAL,CARILION CLINIC,CH,CHANGE OF OWNERSHIP,09/08/2020,O20200810003059,VA,00-17,PART A PROVIDER - RURAL HEALTH CLINIC,1194340091,N,498921,5890607253,CARILION HEALTHCARE CORPORATION,
O20201208003040,IA,00-17,PART A PROVIDER - RURAL HEALTH CLINIC,1124655006,N,168650,0941587307,UNITYPOINT HEALTH - MARSHALLTOWN,UNITYPOINT CLINIC - FAMILY MEDICINE - ROHLF MEMORIAL,CH,CHANGE OF OWNERSHIP,12/06/2020,O20060125000131,IA,00-17,PART A PROVIDER - RURAL HEALTH CLINIC,1487699559,N,168955,8729992318,IOWA PHYSICIANS CLINIC MEDICAL FOUNDATION,UNITYPOINT CLINIC FAMILY MEDICINE ROHLF MEMORIAL
O20201215001314,IA,00-17,PART A PROVIDER - RURAL HEALTH CLINIC,1467089334,N,168649,0941587307,UNITYPOINT HEALTH - MARSHALLTOWN,UNITYPOINT CLINIC - FAMILY MEDICINE - DENVER,CH,CHANGE OF OWNERSHIP,12/06/2020,O20070711000722,IA,00-17,PART A PROVIDER - RURAL HEALTH CLINIC,1336198662,N,168907,8729992318,IOWA PHYSICIANS CLINIC MEDICAL FOUNDATION,UNITYPOINT CLINIC FAMILY MEDICINE DENVER
O20201217000088,VA,00-17,PART A PROVIDER - RURAL HEALTH CLINIC,1184241218,N,493445,3678670221,CARILION GILES COMMUNITY HOSPITAL,,CH,CHANGE OF OWNERSHIP,09/08/2020,O20200810002055,VA,00-17,PART A PROVIDER - RURAL HEALTH CLINIC,1700401601,N,498930,5890607253,CARILION HEALTHCARE CORPORATION,
O20201218002293,SC,00-17,PART A PROVIDER - RURAL HEALTH CLINIC,1528665908,N,428945,2567872070,LEXINGTON HEALTH INC,LMC BATESBURG LEESVILLE RURAL HEALTH CLINIC,CH,CHANGE OF OWNERSHIP,02/01/2021,O20040913001248,SC,00-17,PART A PROVIDER - RURAL HEALTH CLINIC,1073546412,N,428945,7618871799,LEXINGTON COUNTY HEALTH SERVICES DISTRICT INC,LEXINGTON MEDICAL CENTER-BATESBURG/LEESVILLE
O20201218002507,WV,00-17,PART A PROVIDER - RURAL HEALTH CLINIC,1437758034,N,513421,4385055342,MARIETTA MEMORIAL HOSPITAL OF TYLER COUNTY INC,ST MARYS PRIMARY CARE,CH,CHANGE OF OWNERSHIP,10/01/2020,O20191206000803,WV,00-17,PART A PROVIDER - RURAL HEALTH CLINIC,1154722924,N,513421,5698672350,CITY OF SISTERSVILLE,
O20201223000518,TN,00-17,PART A PROVIDER - RURAL HEALTH CLINIC,1386243293,N,443456,4082026695,VANDERBILT BEDFORD HOSPITAL LLC,VANDERBILT INTEGRATED PRIMARY CARE UNIONVILLE,CH,CHANGE OF OWNERSHIP,01/01/2021,O20180730002376,TN,00-17,PART A PROVIDER - RURAL HEALTH CLINIC,1013435908,N,443456,1557307568,SHELBYVILLE HOSPITAL COMPANY LLC,TENNOVA FAMILY CARE-UNIONVILLE
O20210108000736,KY,00-17,PART A PROVIDER - RURAL HEALTH CLINIC,1184676314,N,183942,3971415993,PRIMARY CARE CENTERS OF EASTERN KENTUCKY LLC,PRIMARY CARE CENTERS OF EASTERN KENTUCKY- VICCO,CH,CHANGE OF OWNERSHIP,01/01/2021,O20051114000816,KY,00-17,PART A PROVIDER - RURAL HEALTH CLINIC,1184676314,N,183942,3971415993,PRIMARY CARE CENTERS OF EASTERN KENTUCKY LLC,PRIMARY CARE CENTER OF EASTERN KENTUCKY - VICCO
O20210108001145,TN,00-17,PART A PROVIDER - RURAL HEALTH CLINIC,1659970549,N,443455,4082026695,VANDERBILT BEDFORD HOSPITAL LLC,VANDERBILT INTEGRATED PRIMARY CARE WARTRACE,CH,CHANGE OF OWNERSHIP,01/01/2021,O20180521001091,TN,00-17,PART A PROVIDER - RURAL HEALTH CLINIC,1376061275,N,443455,1557307568,SHELBYVILLE HOSPITAL COMPANY LLC,TENNOVA FAMILY CARE-WARTRACE
